{
  "schema_version": 1,
  "session_id": "SESSION-2026-09-24-magnet-sizing-review",
  "title": "Address PR6 expert cold-mass and vessel sizing constraints",
  "recorded_at": "2026-09-24T09:58:22Z",
  "started_at": null,
  "ended_at": "2026-09-24T10:11:10Z",
  "status": "closed",
  "collection": "contemporaneous",
  "completeness": "partial",
  "limitations": [
    "Actual conversation start time, client identity details and token usage have not been recorded.",
    "2026-10-07 correction: exact completed-turn counters are now recovered for the observations in USAGE-2026-10-07-synchronization.json. This supersedes earlier missing-token statements for these turns only. Model/client version and older coverage remain unknown; no complete project total is claimed."
  ],
  "client": {
    "name": "Codex",
    "version": null,
    "thread_id": null
  },
  "git": {
    "start_commit": "35047957ea565ea0fca53e57c32379d5f0e5fc91",
    "branch": null,
    "initial_changes": [],
    "result_commits": [
      "58a60f9a7bea2fab0c4d977d48847bc4351050ed",
      "2b8c032fb9c6e8aa2333ae5a4c88818cacecc645"
    ],
    "changed_files": [
      ".github/workflows/dashboard.yml",
      "AGENTS.md",
      "docs/design/DES-004-magnetic-configurations.md",
      "docs/design/DES-004-options-summary.md",
      "docs/design/figures/DES-004-mag-01-muon-envelope-rz.png",
      "docs/design/figures/DES-004-mag-01-muon-envelope-rz.svg",
      "docs/design/figures/DES-004-mag-02-muon-envelope-rz.png",
      "docs/design/figures/DES-004-mag-02-muon-envelope-rz.svg",
      "docs/design/figures/DES-004-mag-03-muon-envelope-rz.png",
      "docs/design/figures/DES-004-mag-03-muon-envelope-rz.svg",
      "docs/design/figures/DES-004-mag-04-muon-envelope-rz.png",
      "docs/design/figures/DES-004-mag-04-muon-envelope-rz.svg",
      "docs/design/figures/DES-004-mag-05-muon-envelope-rz.png",
      "docs/design/figures/DES-004-mag-05-muon-envelope-rz.svg",
      "docs/design/figures/DES-004-muon-envelopes-comparison-rz.png",
      "docs/design/figures/DES-004-muon-envelopes-comparison-rz.svg",
      "docs/design/figures/DES-004-sized-winding-axis.png",
      "docs/design/figures/DES-004-sized-winding-axis.svg",
      "docs/design/inputs/DES-004-calorimeter.md",
      "docs/design/inputs/DES-004-envelope-coordination.md",
      "docs/design/inputs/DES-004-inner-space-reallocation.md",
      "docs/design/inputs/DES-004-magnet-expert-review.md",
      "docs/design/inputs/DES-004-magnet-sizing-review.md",
      "docs/design/inputs/DES-004-muon-envelope-amendments.md",
      "docs/design/inputs/DES-004-muon-field-tradeoffs.md",
      "docs/design/inputs/DES-004-muon.md",
      "docs/design/inputs/DES-004-option-physics-review.md",
      "docs/design/inputs/DES-004-option-software-review.md",
      "docs/design/inputs/DES-004-physics-validation.md",
      "docs/design/inputs/DES-004-system-architecture.md",
      "docs/design/inputs/DES-004-tracker.md",
      "docs/design/options/DES-004-MAG-01.md",
      "docs/design/options/DES-004-MAG-02.md",
      "docs/design/options/DES-004-MAG-03.md",
      "docs/design/options/DES-004-MAG-04.md",
      "docs/design/options/DES-004-MAG-05.md",
      "docs/validation/DES-004-magnet-sizing.json",
      "docs/validation/DES-004-muon-envelope-proposals.json",
      "docs/validation/DES-004-sized-winding-benchmark.json",
      "logs/codex/SESSION-2026-09-24-magnet-sizing-review.json",
      "logs/codex/SESSION-2026-09-24-magnet-sizing-review.md",
      "project/reviews.json",
      "project/tracking.json",
      "reference/manifest.yaml",
      "tools/magnetic_study/README.md",
      "tools/magnetic_study/finite_winding.py",
      "tools/magnetic_study/muon-layouts.json",
      "tools/magnetic_study/muon_layouts.py",
      "tools/magnetic_study/requirements-controls.txt",
      "tools/magnetic_study/sizing-policy.json",
      "tools/magnetic_study/sizing.py",
      "tools/magnetic_study/test_sizing.py",
      "tools/magnetic_study/windings.json",
      "logs/usage/USAGE-2026-10-07-synchronization.json"
    ]
  },
  "work": {
    "milestone": "M1",
    "components": [
      "magnetic prototypes",
      "cold-mass and vessel sizing",
      "expert review",
      "tracking merge repair"
    ],
    "related_ids": [
      "DES-004",
      "ADR-006",
      "PR-6",
      "ISSUE-9"
    ]
  },
  "narrative": "logs/codex/SESSION-2026-09-24-magnet-sizing-review.md",
  "activities": [],
  "usage": [
    {
      "client_thread_id": "01a0b3b0-f8f3-7de0-8854-ff1f156bebab",
      "turn_id": "01a0d2d7-0afa-7270-b891-a4e20b4b217b",
      "model": null,
      "source": "2026-09-24 local token_count recovery; logs/usage/USAGE-2026-09-24-local.json; usage SHA-256 488e4f236e5ea197b1e494bd668212d590669782be9a0a3737737de8897390dd; cumulative increases equal last-request counters over persisted turn ordinals 3793..4064.",
      "limitations": [
        "Local client-reported usage only; other-machine coverage and billing equivalence are not established. Per-turn execution model was not reported."
      ],
      "input_tokens": 4878675,
      "cached_input_tokens": 4696064,
      "output_tokens": 26077,
      "reasoning_output_tokens": 4032,
      "total_tokens": 4904752
    }
  ],
  "checks": [
    {
      "command": "shared envelope-venv/bin/python -B tools/magnetic_study/sizing.py",
      "status": "PASS",
      "exit_code": 0,
      "result": "Self-consistent vacuum energy/volume root, both families; 24/96,48/192,96/384 refinement passes."
    },
    {
      "command": "shared envelope-venv/bin/python -B tools/magnetic_study/finite_winding.py",
      "status": "PASS",
      "exit_code": 0,
      "result": "All twelve field benchmark points passed for sized finite homogeneous windings."
    },
    {
      "command": "Initial regenerated muon_layouts.py",
      "status": "FAIL",
      "exit_code": 1,
      "result": "MAG-04 auxiliary trial steel bands still used old radii; propagated same explicit radial amendment and reran successfully."
    },
    {
      "command": "shared envelope-venv/bin/python -B tools/magnetic_study/muon_layouts.py",
      "status": "PASS",
      "exit_code": 0,
      "result": "Five updated layouts pass positive-intersection, sized-vessel containment and radial-band checks; six PNG/SVG drawings generated."
    },
    {
      "command": "shared envelope-venv/bin/python -B -m unittest discover -s tools/magnetic_study -p test_*.py -v",
      "status": "PASS",
      "exit_code": 0,
      "result": "26 tests passed including independent long-solenoid energy limit, B-squared/geometric scaling, closure/refinement, invalid bounds and field cap."
    },
    {
      "command": "python3 -B -m unittest discover -s tools/dashboard -p test_*.py -v",
      "status": "PASS",
      "exit_code": 0,
      "result": "26 dashboard tests passed."
    },
    {
      "command": "python3 -B -m unittest discover -s tools/session_logging -p test_*.py -v",
      "status": "PASS",
      "exit_code": 0,
      "result": "15 logging/documentation tests passed."
    },
    {
      "command": "python3 -B -m unittest discover -s skills/acts-spack/scripts -p test_*.py -v",
      "status": "PASS",
      "exit_code": 0,
      "result": "5 node preflight tests passed; Spack environment not needed or activated."
    },
    {
      "command": "/System/Library/Frameworks/JavaScriptCore.framework/Versions/A/Helpers/jsc tools/dashboard/test_app.js",
      "status": "PASS",
      "exit_code": 0,
      "result": "14 synthetic DOM assertions passed."
    },
    {
      "command": "python3 -B tools/dashboard/build.py validate; build --output _site/pages",
      "status": "PASS",
      "exit_code": 0,
      "result": "29 tasks, 9 documents and 6 rounds validated; dashboard built."
    },
    {
      "command": "SHA-256 validation of three new/current reports; strict JSON duplicate-key and parent stable-ID check",
      "status": "PASS",
      "exit_code": 0,
      "result": "All input/code hashes match; both parent task and PR records retained without duplicate keys."
    },
    {
      "command": "view_image current composite plot",
      "status": "PASS",
      "exit_code": 0,
      "result": "Five layouts, cold-mass/winding legend, expanded outer hosts and withdrawn MAG-06 display inspected."
    },
    {
      "command": "python3 tools/session_logging/session_log.py validate",
      "status": "PASS",
      "exit_code": 0,
      "result": "47 paired records validated."
    },
    {
      "command": "git diff --check",
      "status": "PASS",
      "exit_code": 0,
      "result": "Passed."
    },
    {
      "command": "git diff --cached --check",
      "status": "PASS",
      "exit_code": 0,
      "result": "No staged whitespace errors."
    },
    {
      "command": "git push origin HEAD:research/magnetic-configurations; gh pr edit 6 --body-file /tmp/nodd-pr6-sizing-body.md --add-reviewer mgtmentink; gh pr comment 6 --body-file /tmp/nodd-pr6-sizing-reply.md",
      "status": "PASS",
      "exit_code": 0,
      "result": "Published evidence; updated executive summary and requested expert re-review. https://github.com/asalzburger/nodd/pull/6#issuecomment-5812130449"
    },
    {
      "command": "gh pr view 6 --json headRefOid,mergeable,reviewRequests,statusCheckRollup",
      "status": "PASS",
      "exit_code": 0,
      "result": "Evidence head 2b8c032 is MERGEABLE. Hosted build succeeded, including magnetic tests: https://github.com/asalzburger/nodd/actions/runs/35985506596"
    }
  ]
}
