{
  "schema_version": 1,
  "session_id": "SESSION-2026-10-02-pixel-tdr-overleaf",
  "title": "Publish preliminary PixelDetector subsection to Overleaf",
  "recorded_at": "2026-10-02T16:06:14Z",
  "started_at": null,
  "ended_at": "2026-10-02T16:43:55.372798Z",
  "status": "closed",
  "collection": "contemporaneous",
  "completeness": "partial",
  "limitations": [
    "Exact per-turn client token counters and client thread/version details are unavailable.",
    "Remote publication attempt failed; final branch read confirmed original revision. User subsequently requested expanded content before retry.",
    "2026-10-12 device audit: imported 2 exact closed turns (3,123,670 input / 4,505 output) from logs/usage/USAGE-2026-10-12-device-audit.json. Earlier unavailable-usage statements describe the original capture. Model/client version and complete project coverage remain unknown. Original journal restored from local branch revision 7ec9d05dc5ee9aefdf6c0da30549615ebc06a0b0; historical artifacts/checks are not recreated or rerun."
  ],
  "client": {
    "name": "Codex",
    "version": null,
    "thread_id": null
  },
  "git": {
    "start_commit": "db74bec126646fe225a4ec6c0f6cc57c75eb3140",
    "branch": "documentation/pixel-detector-section",
    "initial_changes": [
      "docs/publication/TDR-outline.md",
      "docs/publication/pixel-detector/README.md",
      "docs/publication/pixel-detector/artifacts.json",
      "docs/publication/pixel-detector/main.pdf",
      "docs/publication/pixel-detector/pixel-detector.pdf",
      "docs/publication/pixel-detector/source/.gitignore",
      "docs/publication/pixel-detector/source/README.md",
      "docs/publication/pixel-detector/source/chapters/introduction.tex",
      "docs/publication/pixel-detector/source/chapters/pixel-detector.tex",
      "docs/publication/pixel-detector/source/chapters/pixel-references.tex",
      "docs/publication/pixel-detector/source/chapters/tracker.tex",
      "docs/publication/pixel-detector/source/data/pixel-layout.json",
      "docs/publication/pixel-detector/source/data/pixel-provenance.json",
      "docs/publication/pixel-detector/source/data/pixel-public-sources.json",
      "docs/publication/pixel-detector/source/data/pixel-render-manifest.json",
      "docs/publication/pixel-detector/source/figures/odd-logo.pdf",
      "docs/publication/pixel-detector/source/figures/odd-mark.pdf",
      "docs/publication/pixel-detector/source/figures/pixel-barrels.pdf",
      "docs/publication/pixel-detector/source/figures/pixel-carrier.pdf",
      "docs/publication/pixel-detector/source/figures/pixel-disc-section.pdf",
      "docs/publication/pixel-detector/source/figures/pixel-endcap.pdf",
      "docs/publication/pixel-detector/source/figures/pixel-modules.pdf",
      "docs/publication/pixel-detector/source/figures/pixel-overview.pdf",
      "docs/publication/pixel-detector/source/figures/pixel-packing.pdf",
      "docs/publication/pixel-detector/source/figures/pixel-services.pdf",
      "docs/publication/pixel-detector/source/figures/pixel-stave.pdf",
      "docs/publication/pixel-detector/source/generated/pixel-barrel-rows.tex",
      "docs/publication/pixel-detector/source/generated/pixel-disc-rows.tex",
      "docs/publication/pixel-detector/source/generated/pixel-ring-rows.tex",
      "docs/publication/pixel-detector/source/main.tex",
      "docs/publication/pixel-detector/source/pixel-detector.tex",
      "docs/publication/pixel-detector/source/scripts/pixel_figures.py",
      "docs/publication/pixel-detector/source/scripts/pixel_snapshot.py",
      "docs/publication/pixel-detector/source/style/odd-tdr.sty",
      "docs/tdr",
      "logs/codex/SESSION-2026-10-02-pixel-tdr.json",
      "logs/codex/SESSION-2026-10-02-pixel-tdr.md",
      "project/tracking.json"
    ],
    "result_commits": [],
    "changed_files": [
      "docs/tdr",
      "docs/publication/pixel-detector/artifacts.json",
      "docs/publication/pixel-detector/source/chapters/pixel-detector.tex",
      "docs/publication/pixel-detector/main.pdf",
      "docs/publication/pixel-detector/pixel-detector.pdf",
      "logs/codex/SESSION-2026-10-02-pixel-tdr-overleaf.json",
      "logs/codex/SESSION-2026-10-02-pixel-tdr-overleaf.md"
    ]
  },
  "work": {
    "milestone": "M1",
    "components": [
      "publication",
      "Overleaf",
      "pixel detector"
    ],
    "related_ids": [
      "PUB-PIXEL-001",
      "TASK-PUB-PIXEL",
      "DES-012",
      "DES-013",
      "DES-014",
      "DES-015",
      "PR-36",
      "PR-37"
    ]
  },
  "narrative": "logs/codex/SESSION-2026-10-02-pixel-tdr-overleaf.md",
  "activities": [],
  "usage": [
    {
      "client_thread_id": "01a0fc8b-30bf-71e2-b9f9-d56074281781",
      "turn_id": "01a0fd5c-f7d4-7861-aa68-53d3a11d8f55",
      "model": null,
      "source": "Usage-only local-device recovery captured 2026-10-12T11:26:10.963832+00:00; logs/usage/USAGE-2026-10-12-device-audit.json; verified event SHA-256 805db3fe068384c2ee186edd118d2a2068dd25e9ce980e523bee84edaf68f0e3; persisted turn ordinals 672..819; 19 reconciled request increases.",
      "limitations": [
        "Actual execution model and client version are not established. Whole closed turn counted once; cached input and reasoning output are subsets."
      ],
      "input_tokens": 2962937,
      "cached_input_tokens": 2812416,
      "output_tokens": 4415,
      "reasoning_output_tokens": 913,
      "total_tokens": 2967352
    },
    {
      "client_thread_id": "01a0fc8b-30bf-71e2-b9f9-d56074281781",
      "turn_id": "01a0fd73-7ff3-7b82-8c57-086bd84f5ee4",
      "model": null,
      "source": "Usage-only local-device recovery captured 2026-10-12T11:26:10.963832+00:00; logs/usage/USAGE-2026-10-12-device-audit.json; verified event SHA-256 868b24c9dc7a93f278118f18c1a3351587f72a738904d775992f6cc50be99f84; persisted turn ordinals 821..829; 1 reconciled request increases.",
      "limitations": [
        "Actual execution model and client version are not established. Whole closed turn counted once; cached input and reasoning output are subsets."
      ],
      "input_tokens": 160733,
      "cached_input_tokens": 160384,
      "output_tokens": 90,
      "reasoning_output_tokens": 0,
      "total_tokens": 160823
    }
  ],
  "checks": [
    {
      "command": "Source-package hash audit",
      "status": "PASS",
      "exit_code": 0,
      "result": "29 TDR sources matched the reviewed source snapshot before whitespace cleanup."
    },
    {
      "command": "git diff --cached --check",
      "status": "PASS",
      "exit_code": 0,
      "result": "Three trailing TeX spaces corrected; staged source passed."
    },
    {
      "command": "latexmk -pdf -interaction=nonstopmode -halt-on-error main.tex / pixel-detector.tex",
      "status": "PASS",
      "exit_code": 0,
      "result": "18/14 pages respectively; no warnings, overflow or unresolved references."
    },
    {
      "command": "git fetch origin",
      "status": "PASS",
      "exit_code": 0,
      "result": "Succeeded after sandbox metadata denial and server HTTP503; original remote7783ea3 unchanged."
    },
    {
      "command": "git push origin HEAD:main (two attempts)",
      "status": "FAIL",
      "exit_code": 1,
      "result": "Both failed with HTTP503 and disconnect. No force-push used."
    },
    {
      "command": "git ls-remote origin refs/heads/main (final attempt)",
      "status": "PASS",
      "exit_code": 0,
      "result": "Returned7783ea3e3235c0fe9da641db3d303a6f211b3073; new5bded5b commit was not published."
    },
    {
      "command": "python3 -B tools/dashboard/build.py validate / build; git diff --check",
      "status": "PASS",
      "exit_code": 0,
      "result": "40 tasks,17 documents,15 rounds validated; dashboard built; diff clean."
    }
  ]
}
