{
  "schema_version": 1,
  "session_id": "SESSION-2026-10-05-disc-layout-comparison",
  "title": "Show existing before/after disc layouts",
  "recorded_at": "2026-10-07T11:58:36Z",
  "started_at": "2026-10-05T17:07:42Z",
  "ended_at": "2026-10-05T17:08:11Z",
  "status": "closed",
  "collection": "retrospective",
  "completeness": "partial",
  "limitations": [
    "Retrospective bounded-task record; original working revision and detailed commands are not reconstructed.",
    "Actual execution model and client version are unknown; older project coverage remains partial.",
    "Git start_commit identifies the observed retrospective-recording checkout, not historical execution.",
    "2026-10-07 correction: exact completed-turn counters are now recovered for the observations in USAGE-2026-10-07-synchronization.json. This supersedes earlier missing-token statements for these turns only. Model/client version and older coverage remain unknown; no complete project total is claimed."
  ],
  "client": {
    "name": "Codex desktop app",
    "version": null,
    "thread_id": "01a10c6a-664d-72b1-afad-926c2c57312b"
  },
  "git": {
    "start_commit": "0ce32f02977790f4b8433f2e838e3b8936773e1a",
    "branch": null,
    "initial_changes": [],
    "result_commits": [],
    "changed_files": [
      "logs/codex/SESSION-2026-10-05-disc-layout-comparison.json",
      "logs/codex/SESSION-2026-10-05-disc-layout-comparison.md",
      "logs/usage/USAGE-2026-10-07-synchronization.json"
    ]
  },
  "work": {
    "milestone": "M0",
    "components": [],
    "related_ids": []
  },
  "narrative": "logs/codex/SESSION-2026-10-05-disc-layout-comparison.md",
  "activities": [],
  "usage": [
    {
      "client_thread_id": "01a10c6a-664d-72b1-afad-926c2c57312b",
      "turn_id": "01a10d09-1942-7951-87f6-b9fabad033df",
      "model": null,
      "source": "Usage-only local recovery captured 2026-10-07T11:43:21.681829+00:00; logs/usage/USAGE-2026-10-07-synchronization.json; verified event SHA-256 a5a8a54556f562bb6194da8b9388e2f330efd52fc2f979f285ddc0199a59ef4f; persisted turn ordinals 1523..1551; 3 reconciled request increases.",
      "limitations": [
        "Execution model and client version are not exposed by the usage-only metadata.",
        "This disjoint completed turn is counted once; cached input and reasoning output are subsets. Current cleanup usage and explicitly excluded illustration work are omitted; older project coverage remains partial."
      ],
      "input_tokens": 298193,
      "cached_input_tokens": 216704,
      "output_tokens": 1232,
      "reasoning_output_tokens": 631,
      "total_tokens": 299425
    }
  ],
  "checks": []
}
