{
  "schema_version": 1,
  "session_id": "SESSION-2026-09-29-service-gap-review",
  "title": "Compare service gaps with upgrade trackers and expose cumulative routing loads",
  "recorded_at": "2026-09-29T12:29:19Z",
  "started_at": null,
  "ended_at": null,
  "status": "open",
  "collection": "contemporaneous",
  "completeness": "partial",
  "limitations": [
    "Exact client-reported per-turn root and subagent token counters are unavailable; usage is empty, not zero.",
    "Historical engineering envelopes are not final-production dimensions or usable all-phi cable capacities.",
    "No geometry, gaps, rows, original capacity/coverage evidence or design approval changes; equivalent widths are additive diagnostics only."
  ],
  "client": {
    "name": "unspecified",
    "version": null,
    "thread_id": null
  },
  "git": {
    "start_commit": "2a3dbfb741f7ea27e77cca3de81690fa800e4567",
    "branch": "study/tracker-service-corridors",
    "initial_changes": [
      "logs/codex/SESSION-2026-09-29-project-usage-summary.json",
      "logs/codex/SESSION-2026-09-29-project-usage-summary.md",
      "logs/usage/USAGE-2026-09-29-local.json",
      "logs/usage/USAGE-2026-09-29-project-summary.json"
    ],
    "result_commits": [],
    "changed_files": [
      "docs/design/DES-010-tracker-service-corridors.md",
      "docs/design/inputs/DES-010-upgrade-service-comparison.md",
      "docs/validation/DES-010-service-gap-review.md",
      "docs/validation/DES-010-tracker-services.md",
      "logs/codex/SESSION-2026-09-29-service-gap-review.json",
      "logs/codex/SESSION-2026-09-29-service-gap-review.md",
      "project/reviews.json",
      "project/tracking.json",
      "reference/manifest.yaml",
      "tools/module_layout/README.md",
      "tools/module_layout/services_profile.py",
      "tools/module_layout/services_profile_views.py",
      "tools/module_layout/test_services_profile.py"
    ]
  },
  "work": {
    "milestone": "M1",
    "components": [
      "tracker services",
      "expert review response",
      "cumulative service inventory"
    ],
    "related_ids": [
      "DES-010",
      "PR-25",
      "REVIEW-DES-010-1"
    ]
  },
  "narrative": "logs/codex/SESSION-2026-09-29-service-gap-review.md",
  "activities": [
    {
      "kind": "tool",
      "name": "collaboration",
      "version": null,
      "calls": null,
      "failures": null,
      "duration_seconds": null,
      "evidence": "Delegated independent ATLAS/CMS source comparisons and cumulative-budget implementation/audit."
    },
    {
      "kind": "skill",
      "name": "acts-spack",
      "version": null,
      "calls": null,
      "failures": null,
      "duration_seconds": null,
      "evidence": "Node preflight warned about changed fingerprints; actual installed Python/NumPy/Matplotlib imports verified before plotting."
    }
  ],
  "usage": [],
  "checks": [
    {
      "command": "python3 skills/acts-spack/scripts/preflight.py",
      "status": "FAIL",
      "exit_code": 2,
      "result": "Changed setup_script/spack_lock; reported and required plotting runtime reverified."
    },
    {
      "command": "acts run acts-nodd; activate installed pyvenv; import sys,numpy,matplotlib",
      "status": "PASS",
      "exit_code": 0,
      "result": "Installed Python3.14.5, NumPy2.5.3, Matplotlib3.11.2. Sister source HEAD355ea684 with existing changes preserved."
    },
    {
      "command": "Initial root focused profile test/probe/plot attempt",
      "status": "FAIL",
      "exit_code": 1,
      "result": "Duplicate provenance keyword while reconciling root/agent additions caused SyntaxError; dependent preview lacked profile input. Duplicate removed; no retained reference evidence changed."
    },
    {
      "command": "python3 -B -m unittest discover -s tools/module_layout -p test_services_profile.py -v",
      "status": "PASS",
      "exit_code": 0,
      "result": "10 controls passed after provenance reconciliation."
    },
    {
      "command": "python3 -B -m unittest discover -s tools/module_layout -p test_services*.py -v",
      "status": "PASS",
      "exit_code": 0,
      "result": "49 tests passed in4.631s; includes original services budget/geometry/driver tests and10 additive-profile controls."
    }
  ]
}
